{"format": "lunarsim-trace", "version": 1, "engine": "python", "scenario": "P1", "mechanism": "marketplace", "seed": 3, "world": {"sites": [{"name": "PAD_A", "x": 0.0, "y": 0.0, "kind": "pad"}, {"name": "PAD_B", "x": 1.2, "y": -0.9, "kind": "pad"}, {"name": "DEPOT", "x": 1.1, "y": 0.7, "kind": "depot"}, {"name": "BASE", "x": 1.4, "y": 1.0, "kind": "base"}, {"name": "POWER", "x": 1.9, "y": 1.6, "kind": "power"}, {"name": "CONSTR", "x": 1.0, "y": 1.5, "kind": "construction"}, {"name": "ISRU", "x": 2.6, "y": 0.9, "kind": "isru"}, {"name": "SCI_1", "x": 3.2, "y": 2.3, "kind": "science"}, {"name": "PSR", "x": 4.6, "y": 3.0, "kind": "psr"}], "edges": [{"a": "DEPOT", "b": "PAD_A", "dist": 1.6949926253526888, "slope": "flat"}, {"a": "DEPOT", "b": "PAD_B", "dist": 2.0840585404445817, "slope": "moderate"}, {"a": "PAD_A", "b": "PAD_B", "dist": 1.9500000000000002, "slope": "flat"}, {"a": "BASE", "b": "DEPOT", "dist": 0.5515432893255069, "slope": "flat"}, {"a": "BASE", "b": "POWER", "dist": 1.0153324578678653, "slope": "moderate"}, {"a": "BASE", "b": "CONSTR", "dist": 0.8324061508662702, "slope": "flat"}, {"a": "DEPOT", "b": "ISRU", "dist": 1.9672569735548022, "slope": "moderate"}, {"a": "BASE", "b": "ISRU", "dist": 1.5654072952429985, "slope": "moderate"}, {"a": "POWER", "b": "SCI_1", "dist": 1.9194269978303422, "slope": "steep"}, {"a": "ISRU", "b": "SCI_1", "dist": 1.9801010075246162, "slope": "moderate"}, {"a": "PSR", "b": "SCI_1", "dist": 2.034821859524808, "slope": "steep"}, {"a": "ISRU", "b": "PSR", "dist": 3.77, "slope": "steep"}]}, "horizon_h": 8760.0, "nights": [[602.412, 708.72], [1311.132, 1417.44], [2019.852, 2126.1600000000003], [2728.572, 2834.88], [3437.292, 3543.6], [4146.012, 4252.32], [4854.732, 4961.04], [5563.452, 5669.76], [6272.172, 6378.48], [6980.892, 7087.2], [7689.612, 7795.92], [8398.332, 8504.640000000001], [9107.052, 8760.0]], "landings": [[824.5669060258969, "CLPS", "PAD_A"], [5099.7394359238615, "CLPS", "PAD_A"], [6434.89584634472, "MK1", "PAD_A"]], "vehicles": [{"id": 0, "owner": "NASA", "cls": "LTV", "autonomy": "supervised", "capacity": 1500, "night_ops": false}, {"id": 1, "owner": "CoA", "cls": "LTV", "autonomy": "supervised", "capacity": 1500, "night_ops": false}, {"id": 2, "owner": "CoB", "cls": "MICRO", "autonomy": "teleop", "capacity": 300, "night_ops": false}], "jobs": [{"kind": "auction", "veh": 0, "team": [0], "t0": 54.873474609722564, "t1": 56.34119634139405, "segments": [["DEPOT", "CONSTR", 54.873474609722564, 55.0870470541966, 0.0], ["CONSTR", "CONSTR", 55.0870470541966, 55.6370470541966, 0.0], ["CONSTR", "BASE", 55.6370470541966, 55.791196341394055, 500.0], ["BASE", "BASE", 55.791196341394055, 56.34119634139405, 500.0]], "items": [[1, 500, 3, "bulk", "BASE"]]}, {"kind": "auction", "veh": 0, "team": [0], "t0": 172.4440676627191, "t1": 173.82667468924782, "segments": [["BASE", "CONSTR", 172.4440676627191, 172.57252540205033, 0.0], ["CONSTR", "CONSTR", 172.57252540205033, 173.12252540205034, 0.0], ["CONSTR", "BASE", 173.12252540205034, 173.2766746892478, 500.0], ["BASE", "BASE", 173.2766746892478, 173.82667468924782, 500.0]], "items": [[2, 500, 3, "bulk", "BASE"]]}, {"kind": "auction", "veh": 0, "team": [0], "t0": 305.87169198046996, "t1": 307.2542990069987, "segments": [["BASE", "CONSTR", 305.87169198046996, 306.0001497198012, 0.0], ["CONSTR", "CONSTR", 306.0001497198012, 306.5501497198012, 0.0], ["CONSTR", "BASE", 306.5501497198012, 306.70429900699867, 500.0], ["BASE", "BASE", 306.70429900699867, 307.2542990069987, 500.0]], "items": [[3, 500, 3, "bulk", "BASE"]]}, {"kind": "auction", "veh": 0, "team": [0], "t0": 474.6725924299685, "t1": 476.05519945649723, "segments": [["BASE", "CONSTR", 474.6725924299685, 474.80105016929974, 0.0], ["CONSTR", "CONSTR", 474.80105016929974, 475.35105016929975, 0.0], ["CONSTR", "BASE", 475.35105016929975, 475.5051994564972, 500.0], ["BASE", "BASE", 475.5051994564972, 476.05519945649723, 500.0]], "items": [[4, 500, 3, "bulk", "BASE"]]}, {"kind": "auction", "veh": 0, "team": [0], "t0": 708.720001, "t1": 710.1026080265286, "segments": [["BASE", "CONSTR", 708.720001, 708.8484587393312, 0.0], ["CONSTR", "CONSTR", 708.8484587393312, 709.3984587393312, 0.0], ["CONSTR", "BASE", 709.3984587393312, 709.5526080265287, 500.0], ["BASE", "BASE", 709.5526080265287, 710.1026080265286, 500.0]], "items": [[5, 500, 3, "bulk", "BASE"]]}, {"kind": "auction", "veh": 0, "team": [0], "t0": 820.6150202060704, "t1": 821.997627232599, "segments": [["BASE", "CONSTR", 820.6150202060704, 820.7434779454017, 0.0], ["CONSTR", "CONSTR", 820.7434779454017, 821.2934779454016, 0.0], ["CONSTR", "BASE", 821.2934779454016, 821.4476272325991, 500.0], ["BASE", "BASE", 821.4476272325991, 821.997627232599, 500.0]], "items": [[6, 500, 3, "bulk", "BASE"]]}, {"kind": "auction", "veh": 0, "team": [0], "t0": 832.0950119248753, "t1": 833.9577247354141, "segments": [["BASE", "PAD_A", 832.0950119248753, 832.4416995660293, 0.0], ["PAD_A", "PAD_A", 832.4416995660293, 832.9916995660293, 0.0], ["PAD_A", "BASE", 832.9916995660293, 833.4077247354141, 342.7535152040059], ["BASE", "BASE", 833.4077247354141, 833.9577247354141, 342.7535152040059]], "items": [[60, 342.8, 1, "consumables", "BASE"]]}, {"kind": "auction", "veh": 0, "team": [0], "t0": 868.4933709073235, "t1": 869.8759779338521, "segments": [["BASE", "CONSTR", 868.4933709073235, 868.6218286466548, 0.0], ["CONSTR", "CONSTR", 868.6218286466548, 869.1718286466547, 0.0], ["CONSTR", "BASE", 869.1718286466547, 869.3259779338522, 500.0], ["BASE", "BASE", 869.3259779338522, 869.8759779338521, 500.0]], "items": [[7, 500, 3, "bulk", "BASE"]]}, {"kind": "auction", "veh": 0, "team": [0], "t0": 1067.6878932336547, "t1": 1069.0705002601833, "segments": [["BASE", "CONSTR", 1067.6878932336547, 1067.816350972986, 0.0], ["CONSTR", "CONSTR", 1067.816350972986, 1068.3663509729859, 0.0], ["CONSTR", "BASE", 1068.3663509729859, 1068.5205002601833, 500.0], ["BASE", "BASE", 1068.5205002601833, 1069.0705002601833, 500.0]], "items": [[8, 500, 3, "bulk", "BASE"]]}, {"kind": "auction", "veh": 0, "team": [0], "t0": 1220.6475365138429, "t1": 1222.0301435403715, "segments": [["BASE", "CONSTR", 1220.6475365138429, 1220.775994253174, 0.0], ["CONSTR", "CONSTR", 1220.775994253174, 1221.325994253174, 0.0], ["CONSTR", "BASE", 1221.325994253174, 1221.4801435403715, 500.0], ["BASE", "BASE", 1221.4801435403715, 1222.0301435403715, 500.0]], "items": [[9, 500, 3, "bulk", "BASE"]]}, {"kind": "auction", "veh": 0, "team": [0], "t0": 1307.7372303558232, "t1": 1309.1198373823518, "segments": [["BASE", "CONSTR", 1307.7372303558232, 1307.8656880951544, 0.0], ["CONSTR", "CONSTR", 1307.8656880951544, 1308.4156880951543, 0.0], ["CONSTR", "BASE", 1308.4156880951543, 1308.5698373823518, 500.0], ["BASE", "BASE", 1308.5698373823518, 1309.1198373823518, 500.0]], "items": [[10, 500, 3, "bulk", "BASE"]]}, {"kind": "auction", "veh": 1, "team": [1], "t0": 1417.4400010000002, "t1": 1418.9077227316716, "segments": [["DEPOT", "CONSTR", 1417.4400010000002, 1417.6535734444742, 0.0], ["CONSTR", "CONSTR", 1417.6535734444742, 1418.2035734444742, 0.0], ["CONSTR", "BASE", 1418.2035734444742, 1418.3577227316716, 500.0], ["BASE", "BASE", 1418.3577227316716, 1418.9077227316716, 500.0]], "items": [[11, 500, 3, "bulk", "BASE"]]}, {"kind": "auction", "veh": 2, "team": [2], "t0": 1469.1428840349568, "t1": 1472.8203785738588, "segments": [["DEPOT", "BASE", 1469.1428840349568, 1469.5126130708713, 0.0], ["BASE", "BASE", 1469.5126130708713, 1470.1876130708713, 0.0], ["BASE", "PAD_A", 1470.1876130708713, 1472.1453785738588, 97.87216817913553], ["PAD_A", "PAD_A", 1472.1453785738588, 1472.8203785738588, 97.87216817913553]], "items": [[62, 97.9, 3, "return", "PAD_A"]]}, {"kind": "auction", "veh": 0, "team": [0], "t0": 1699.1252011158963, "t1": 1700.507808142425, "segments": [["BASE", "CONSTR", 1699.1252011158963, 1699.2536588552275, 0.0], ["CONSTR", "CONSTR", 1699.2536588552275, 1699.8036588552275, 0.0], ["CONSTR", "BASE", 1699.8036588552275, 1699.957808142425, 500.0], ["BASE", "BASE", 1699.957808142425, 1700.507808142425, 500.0]], "items": [[12, 500, 3, "bulk", "BASE"]]}, {"kind": "auction", "veh": 0, "team": [0], "t0": 1746.5665795604639, "t1": 1747.9491865869925, "segments": [["BASE", "CONSTR", 1746.5665795604639, 1746.695037299795, 0.0], ["CONSTR", "CONSTR", 1746.695037299795, 1747.245037299795, 0.0], ["CONSTR", "BASE", 1747.245037299795, 1747.3991865869925, 500.0], ["BASE", "BASE", 1747.3991865869925, 1747.9491865869925, 500.0]], "items": [[13, 500, 3, "bulk", "BASE"]]}, {"kind": "auction", "veh": 1, "team": [1], "t0": 1894.8419572970133, "t1": 1896.224564323542, "segments": [["BASE", "CONSTR", 1894.8419572970133, 1894.9704150363445, 0.0], ["CONSTR", "CONSTR", 1894.9704150363445, 1895.5204150363445, 0.0], ["CONSTR", "BASE", 1895.5204150363445, 1895.674564323542, 500.0], ["BASE", "BASE", 1895.674564323542, 1896.224564323542, 500.0]], "items": [[14, 500, 3, "bulk", "BASE"]]}, {"kind": "auction", "veh": 0, "team": [0], "t0": 2126.1600009999997, "t1": 2127.542608026529, "segments": [["BASE", "CONSTR", 2126.1600009999997, 2126.288458739331, 0.0], ["CONSTR", "CONSTR", 2126.288458739331, 2126.838458739331, 0.0], ["CONSTR", "BASE", 2126.838458739331, 2126.9926080265286, 500.0], ["BASE", "BASE", 2126.9926080265286, 2127.542608026529, 500.0]], "items": [[15, 500, 3, "bulk", "BASE"]]}, {"kind": "auction", "veh": 0, "team": [0], "t0": 2226.4337902240723, "t1": 2227.8163972506013, "segments": [["BASE", "CONSTR", 2226.4337902240723, 2226.5622479634035, 0.0], ["CONSTR", "CONSTR", 2226.5622479634035, 2227.1122479634037, 0.0], ["CONSTR", "BASE", 2227.1122479634037, 2227.266397250601, 500.0], ["BASE", "BASE", 2227.266397250601, 2227.8163972506013, 500.0]], "items": [[16, 500, 3, "bulk", "BASE"]]}, {"kind": "auction", "veh": 0, "team": [0], "t0": 2355.8112121165473, "t1": 2357.1938191430763, "segments": [["BASE", "CONSTR", 2355.8112121165473, 2355.9396698558785, 0.0], ["CONSTR", "CONSTR", 2355.9396698558785, 2356.4896698558787, 0.0], ["CONSTR", "